{
  "fullName": "Diego Javier Lalanda",
  "headline": "Desarrollador Web Full Stack | AI Engineer | Docente",
  "email": "lala.dev.tech@gmail.com",
  "phone": "+54 9 3456023111",
  "location": {
    "city": "Concordia",
    "region": "Entre Ríos",
    "country": "Argentina",
    "timezone": "America/Argentina/Cordoba"
  },
  "availability": "open-to-freelance",
  "links": [
    {
      "label": "LinkedIn",
      "url": "https://www.linkedin.com/in/diego-lalanda-9576b21b8/",
      "type": "linkedin"
    },
    {
      "label": "GitHub",
      "url": "https://github.com/DiegoLalanda",
      "type": "github"
    }
  ],
  "preferredContactMethod": "email",
  "resumeUrl": null
}
